id,organization_id,accessibility,admin_emails,alternate_name,description,email,languages,latitude,longitude,name,transportation,virtual,website
914,493,,,,"No description",,,48.089429,-123.1119067,"Peninsula Children's Clinic - Sequim","From W Hendrickson Rd turn north onto N 5th Ave.  Located on the right-hand side before reaching Old Olympic Highway.",FALSE,
915,494,,,,"No description",,,47.6246927,-122.5169514,"Washington State Department of Licensing - Kitsap - Bainbridge Chamber of Commerce","From Highway 305 turn right onto Winslow Way E.  Located between the Streamliner Diner and Johansson Clark Realty.",FALSE,
916,494,,,,"No description",,,47.7467922,-122.6538622,"Washington State Department of Licensing - Kitsap - JRO Licensing Agency","From NW Finn Hill Rd or Viking Way NW turn onto NW Lindvig Way.  Turn the immediate right into the business center.",FALSE,
917,494,,,,"No description",,,47.569883,-122.665855,"Washington State Department of Licensing - Kitsap - Kitsap Auto Licensing","Next to Family Pancake House.",FALSE,
918,494,,,,"No description",,,47.7358122,-122.6382079,"Washington State Department of Licensing - Kitsap - Poulsbo","From Highway 305 turn west onto NE Lincoln Rd.  Take the next left onto 8th Ave NE and turn left into the parking lot.",FALSE,
919,494,,,,"No description",,,47.6075715,-122.6309616,"Washington State Department of Licensing - Kitsap - Bremerton","From Wheaton Way turn west onto NE Riddell Rd.  Turn right Redwood Plaza.",FALSE,
920,494,,,,"No description",,,47.6456353,-122.6983756,"Washington State Department of Licensing - Kitsap - Silverdale Auto License","Located in the shopping center on Silverdale Way NW across from Red Apple Supermarket.",FALSE,
921,494,,,,"No description",,,47.5372693,-122.6377052,"Washington State Department of Licensing - Kitsap - Kitsap County Auditor Auto License","From Bay St turn onto Dekalb St.  Turn right onto Cline Ave.  Turn left onto Division St.  Located in the Auditors office.",FALSE,
922,495,,,,"No description",,,48.1200563,-123.4367773,"Washington State Department of Licensing - Clallam","From W Front St turn south onto N Cherry St.  Turn left onto W 1st St.  Located in the Armory Square.",FALSE,
923,495,,,,"No description",,,47.9466694,-124.391688,"Washington State Department of Licensing - Forks","Located on the corner of Bogachiel Way and N 5th Ave in the DSHS Building near Forks Community Hospital.",FALSE,
924,495,,,,"No description",,,48.1155739,-123.4337165,"Washington State Department of Licensing - Clallam - Clallam County Auditor Auto Licensing","Located in the Auditors office at the Clallam County Courthouse near the corner of S Lincoln and E 4th Streets.",FALSE,
925,495,,,,"No description",,,48.0794179,-123.116784,"Washington State Department of Licensing - Clallam - Sequim Licensing Depot","Located on W Washington Ave near Safeway.",FALSE,
926,495,,,,"No description",,,47.9619209,-124.399085,"Washington State Department of Licensing - Clallam - West End Vehicle Licensing","Follow N Forks Ave (Highway 101) north past Sol Duc Way.",FALSE,
927,496,,,,"No description",,,48.1118734,-122.7671483,"Washington State Department of Licensing - Jefferson - Jefferson County Auditor Auto Licensing","From E Sims Way turn onto Washington St.  Turn left onto Walker St.  Turn right onto Jefferson St.  Located in the Auditors office.",FALSE,
928,496,,,,"No description",,,48.104537,-122.803349,"Washington State Department of Licensing - Jefferson","From W Sims Way turn Howard St.  Licensing office located next to the Goodwill.",FALSE,
929,497,,,,"No description",drstevenwexler@gmail.com,,47.5748097,-122.6880001,"Northwest Family Counseling Services","From Highway 3 take Kitsap Way west.  Turn right on Crawford Dr.",FALSE,
930,498,,,,"No description",,,48.120759,-123.435662,"Family Medicine of Port Angeles","Located on W Front St near Cherry St past the ferries.",FALSE,
931,499,,,,"No description",frontstreetclinic@yahoo.com,,47.7459276,-122.6499514,"Front Street Clinic","Located across from Liberty Bay Auto Center near the intersection of NW Lindvig Way and Front St.",FALSE,
932,499,,,,"No description",frontstreetclinic@yahoo.com,,47.6488891,-122.5246209,"Front Street Clinic - Bainbridge Island","From Highway 305 turn west onto Sportsman Club Rd NE.  Turn onto Coppertop Loop.",FALSE,
933,500,,,,"No description",action@olycap.org,,48.105573,-122.80489,"Olympic Community Action Programs - Port Townsend","From State Route 20 turn north onto Howard St.  Turn right onto S Park, left onto W Park Ave, then left onto Commerce Loop.",FALSE,
934,500,,,,"No description",action@olycap.org,,48.116159,-122.753053,"Olympic Community Action Programs - Jefferson - American Legion Hall","Monroe is at the end of Water St.",FALSE,
935,501,,,,"No description",,,47.5689363,-122.632597,"Asset Building Coalition of Kitsap County","Located at Kitsap Community Services on the corner of 8th Street and Warren Avenue.",FALSE,
936,502,,,,"No description",,,47.0045196,-123.4013747,"East Grays Harbor County Food Bank","From Olympic Highway 12 take the Elma exit.  Turn right onto S 3rd St, then right on W Main St.  Located adjacent to the senior center, across from the Timberland Library.",FALSE,
937,503,,,,"No description",,,48.1058792,-123.4388096,"Port Angeles Library","From Highway 101 turn west on E Lauridsen Blvd by Jefferson Elementary School and Albertsons.  Library will be located on the right.",FALSE,
938,503,,,,"No description",,,47.9503801,-124.3784498,"Forks City Hall - Council Chambers","From N Forks Ave (Highway 101) turn east onto E Division St.  Taxes will be prepared in the City Council Chamber.",FALSE,
939,503,,,,"No description",,,48.2627725,-124.3020632,"Sekiu Community Center","Located in the Sekiu Community Center.",FALSE,
940,503,,,,"No description",,,,,"*Main Site (AARP Tax-Aide - Clallam)",blank,FALSE,
941,503,,,,"No description",,,48.111515,-123.43351,"Port Angeles Senior Center","Located on the corner of East 7th and S Peabody Streets.",FALSE,
942,503,,,,"No description",,,48.0756378,-123.0885248,"Shipley Center","From Highway 101 take S Sequim Ave north.  Turn right at East Washington St.  Turn right on S Brown Rd and follow to the Shipley Center (formerly Sequim Senior Center) on the right.",FALSE,
943,504,,,,"No description",,,,,"*Main Site (AARP Tax-Aide - Jefferson)",blank,FALSE,
944,504,,,,"No description",,,48.1168708,-122.7601786,"Port Townsend Community Center","Located on the corner of Tyler and Lawrence Streets.",FALSE,
945,504,,,,"No description",,,48.0135457,-122.7768348,"Tri-Area Community Center","Located on the corner of West Valley Rd and Rhody Drive (Highway 19).",FALSE,
946,504,,,,"No description",,,47.821671,-122.8790532,"Quilcene Community Center","Located in Quilcene at the corner of Olympic Highway (Highway 101) and Bowen St.",FALSE,
947,505,,,,"No description",,,46.7161325,-124.0051102,"Shoalwater Bay Indian Tribe - Wellness Center","From Highway 105 tun south away from the Shoalwater Bay Casino.",FALSE,
948,505,,,,"No description",,,46.7161325,-124.0051102,"Shoalwater Bay Indian Tribe","From Highway 105 tun south away from the Shoalwater Bay Casino.",FALSE,
949,506,,,,"No description",,,47.9506586,-123.3456072,"North Olympic Peninsula Narcotics Anonymous","No physical location.",FALSE,
950,507,,,,"No description",info@clcpo.org,,47.5228935,-122.6294953,"Christian Life Center","From Highway 16 take the Tremont exit.  Follow Tremont then take a right onto SE Lund Ave.  Turn Left on Bethel Ave, then right on Mitchell Rd or SE Lincoln Ave.",FALSE,
951,508,,,,"No description",info@kcr.org,,47.571982,-122.630917,"Kitsap Community Resources","From Warren Ave turn east onto 11th Ave.  Turn left onto Park Ave.  Located near the intersection of Park and 12th Ave.",FALSE,
952,508,,,,"No description",info@kcr.org,,47.5689363,-122.632597,"Kitsap Community Resources","On the corner of 8th and Warren Avenue.",FALSE,
953,508,,,,"No description",info@kcr.org,,47.5206667,-122.6094186,"Kitsap Community Resources - South Kitsap Community Services Center","Located near the corner of Jackson and Lund Avenues behind the AM/PM Mini Mart.",FALSE,
954,508,,,,"No description",,,47.648395,-122.69898,"Kitsap Community Resources - Martha Mary Child Center",,FALSE,
955,508,,,,"No description",info@kcr.org,,,,"Kitsap Community Resources - Safe Park","Location is confidential.  Address will be given during Housing Solutions Center intake.",FALSE,
956,509,,,,"No description",admin@clallamfire2.org,,48.1150236,-123.436199,"Clallam County Fire District 2","From S Lincoln St (Highway 101) turn onto E 5th St.  Located on the corner of E 5th and S Laurel Streets.",FALSE,
957,510,,,,"No description",Rlawrence@esd.wa.gov,,47.2250535,-123.1262147,"WorkSource - Mason","From Highway 101 take the Wallace Kneeland exit.  Turn right onto Olympic Highway N.  Worksource is located behind McDonalds next to DSHS.",FALSE,
958,511,,,,"No description",,,46.9719581,-123.8218225,"DSHS - Division of Children and Family Services - Grays Harbor","From I-5 North or South at Olympia
1. Take US 101 N exit towards Aberdeen/Port Angeles.
2. After merging onto US 101 N.
3. Stay on it until you reach Aberdeen, you will be on Wishkah Street.
4. At the Olympia Gateway Mall, get into the left lane, follow t",FALSE,
959,512,,,,"No description",,,46.664895,-123.7944013,"DSHS - Division of Children and Family Services - South Bend","From I-5 North: Take I-5 to Chehalis, exit 77. Turn west on Hwy 6 and proceed 50 miles to Raymond.  At the intersection of Hwy 6 and Hwy 101, turn left. Travel three miles to South Bend. As you come into South Bend, the office is on the right just past th",FALSE,
960,512,,,,"No description",,,46.3707216,-124.053369,"DSHS - Division of Children and Family Services","From Hwy 101 travel to the Seaview intersection then make a right-hand turn. Go thru the middle of town and continue through 2 lights. Continue until you see the 'BREAKERS' sign (about 3 miles up the peninsula). Turn left into the parking lot of the 'Long",FALSE,
961,513,,,,"No description",,,,,"Paratransit Services","Call for information.",FALSE,
962,514,,,,"No description",wyacadet@wya.olympic.edu,,47.5547072,-122.6807327,"Washington Youth Academy","From WA-3 N take the Loxie Eagans Blvd exit.  Turn left onto W Loxie Egans Blvd.  Loxie Eagans Blvd becomes W Werner Rd.  Turn Left on Union Ave W.  Turn Right on Pendergast, then Right on Carver St.",FALSE,
963,515,,,,"No description",office@suquamishucc.org,,47.7327808,-122.5579911,"Suquamish Community Kitchen","Located at the Suquamish United Church of Christ on the corner of Division Ave and Geneva St.",FALSE,
964,516,,,,"No description",,,47.569271,-122.6265693,"A Step for Change Counseling Services","Located on Pacific Ave between 8th and 9th Streets.  Offers some in-home therapy sessions.",FALSE,
965,517,,,,"No description",lighthousecounselingpt@gmail.com,,48.113502,-122.7593619,"Lighthouse Counseling Center","Located a block and a half north of the Ferry Terminal next to Filmore St.",FALSE,
966,518,,,,"No description",peteram@dshs.wa.gov,,46.9753327,-123.8506728,"Olympic Area Agency on Aging - Grays Harbor","Located on Highway 101 / Simpson Ave at the corner of Ash St.",FALSE,
967,519,,,,"No description",,,47.9491609,-124.387328,"Forks Community Food Bank","From South Forks Ave (Highway 101) turn onto Bogachiel Way.",FALSE,
968,520,,,,"No description",,,46.9792794,-123.8469526,"Grays Harbor Community Hospital","Take Highway 101/Simpson Ave and turn North on Oak St.  Follow Oak St around to the Hospital.  A shuttle is also available from Olympic Stadium.",FALSE,
969,521,,,,"No description",,,,,"Peninsulas' Other Resources Not Listed","No location.",FALSE,
970,522,,,,"No description",,,48.1067813,-122.7906383,"DSHS - Aging and Long-Term Support Administration - Home and Community Services","From W Sims Way turn north onto Sheridan St.  Located on Corner of Sheridan and 7th streets, across from Jefferson Healthcare.",FALSE,
971,523,,,,"No description",,,48.1067813,-122.7906383,"Department of Social and Health Services - Division of Vocational Rehabilitation","The office is located across the street from the Jefferson Healthcare Hospital parking lot.",FALSE,
972,524,,,,"No description",,,48.1067813,-122.7906383,"DSHS - Division of Child and Family Services","The office is located across the street from the Port Townsend Hospital.",FALSE,
973,525,,,,"No description",,,48.1067813,-122.7906383,"DSHS - Developmental Disabilities Administration - Jefferson","The office is located across the street from the Jefferson General Hospital.",FALSE,
974,526,,,,"No description",,,48.120206,-123.435567,"DSHS - Developmental Disabilities Administration - Clallam","Located near West 1st and North Oak Streets.",FALSE,
975,527,,,,"No description",,,48.120778,-123.436965,"DSHS - Aging and Long-Term Support Administration - Home and Community Services - Port Angeles","Located near the intersection of W 1st and N Cherry Streets.",FALSE,
976,528,,,,"No description",,,47.9466694,-124.391688,"DSHS - Division of Children and Family Services - Forks","Located near the corner of 5th Ave and Bogachiel Way, across from Fork Community Hospital.",FALSE,
977,528,,,,"No description",,,48.1203332,-123.4367054,"DSHS - Division of Children and Family Services","Located on the northwest corner of Oak St and 1st St, on the second floor.",FALSE,
978,529,,,,"No description",,,48.120206,-123.435567,"DSHS - Division of Vocational Rehabilitation","Co-located in the Same buiding as the DSHS Community Services Office at the intersection of 1st and Oak Streets.",FALSE,
979,530,,,,"No description",,,47.5667256,-122.6614791,"DSHS - Developmental Disabilities Administration - Kitsap","Space provided by the Olympic Center located at 6th and Marion, Rm 110.",FALSE,
980,531,,,,"No description",,,47.5583205,-122.6779757,"DSHS - Aging and Long-Term Support Administration - Home and Community Services","The office is located kitty-corner from the Washington State Patrol.  Kean St is also Auto Center Blvd.",FALSE,
981,532,,,,"No description",,,47.5667256,-122.6614791,"DSHS - Division of Children and Family Services","From Kitsap Way (Highway 310) turn south onto Adele Ave.  Follow to end of street and turn left onto 6th St.",FALSE,
982,533,,,,"No description",,,47.6529913,-122.6963369,"DSHS - Division of Vocational Rehabilitation","From Silverdale Way NW turn west onto NW Bucklin Hill Rd.  At the stoplight turn right onto NW Randall Way.  Located by Sound Publishing Building.",FALSE,
983,534,,,,"No description",,,47.2250535,-123.1262147,"DSHS - Developmental Disabilities Administration - Mason","The office is located behind McDonald's in the Olympic Gateway Shopping Center.",FALSE,
984,535,,,,"No description",,,47.2250535,-123.1262147,"DSHS - Community Services Offices - Mason","The office is located behind McDonald's in the Olympic Gateway Shopping Center. 
",FALSE,
985,536,,,,"No description",,,46.9719581,-123.8218225,"DSHS - Developmental Disabilities Administration - Grays Harbor","The office is the Elliot Building building just after Quizno's and before Aberdeen Inn.",FALSE,
986,537,,,,"No description",,,46.9719581,-123.8218225,"DSHS - Community Services Office - Grays Harbor","The office is the red brick building just before the Red Lion Inn.",FALSE,
987,538,,,,"No description",,,46.3707216,-124.053369,"DSHS - Community Services Offices - Long Beach","Located at the intersection of Pacific Ave N (Highway 103) and 18th St S.",FALSE,
988,538,,,,"No description",,,46.664895,-123.7944013,"DSHS - Community Services Offices - South Bend","Located on E Robert Bush Dr (Highway 101).",FALSE,
989,539,,,,"No description",welcome@pflc.org,,47.7335484,-122.6440872,"First Lutheran Church","Follow Highway 305 and turn toward the marina at Hostmark.  Turn right on 4th Ave.",FALSE,
990,540,,,,"No description",,,47.7386209,-122.6269589,"Seventh Day Adventists Church","Located on the corner of NE Lincoln Rd and Caldart Ave NE.",FALSE,
991,540,,,,"No description",,,47.577681,-122.633579,"Bremerton Sons of Norway","Located in the Sons of Norway building across from Olympic College by the base of the Warren Ave Bridge.",FALSE,
992,540,,,,"No description",,,47.7984994,-122.4980321,"Kingston Community Center","Located under the library near the Kingston-Edmonds Ferry at the intersection of NE West Kingston Rd and Highway 104.",FALSE,
993,540,,,,"No description",sharenetdirector@centurytel.net,,47.7983025,-122.5089141,"Bayside Community Church","From Highway 104 turn right onto NE West Kingston Rd.  Turn right onto Barber Cut Off Rd.",FALSE,
994,540,,,,"No description",,,47.0046765,-123.4016395,"Elma Senior Center",,FALSE,
995,540,,,,"No description",,,47.7357493,-122.6277753,"St Olaf's Church - Parish Hall","Located across the streets from the NKHS Tennis Courts in the Parish Hall.",FALSE,
996,540,,,,"No description",,,47.5822754,-122.6296377,"Sheridan Park Center","From Warren Ave bridge take the Clare Ave exit (1st exit) and follow to the intersection with Lebo Blvd.  Building located on the right.
From north of Warren Ave Bridge, turn right on Sheridan.  Turn left on Elm St, then left on Lebo Blvd.  Follow Lebo Bl",FALSE,
997,540,,,,"No description",,,46.676082,-123.7374092,"Pacific County Senior Center",,FALSE,
998,540,,,,"No description",,,47.2150945,-123.1007066,"Faith Lutheran Church",,FALSE,
999,540,,,,"No description",,,47.734186,-122.640054,"Gateway Fellowship","Located on the corner of 8th Ave NE and NE Hostmark St.",FALSE,
1000,540,,,,"No description",,,48.079402,-123.100481,"Sequim VFW Hall",,FALSE,
1001,540,,,,"No description",,,47.4514588,-122.826946,"Hawkins Middle School - East Addition","Located on State Route 3 north of Allyn.",FALSE,
1002,540,,,,"No description",,,46.4920769,-124.04876,"Pacific County Fire District #1","Call for more information.",FALSE,
1003,540,,,,"No description",,,46.8903425,-124.1042336,"Westport Senior Center",,FALSE,
1004,540,,,,"No description",,,47.5899604,-122.6295299,"Bremerton Boys and Girls Club Teen Center - Old East High School Gym","Located off Wheaton Way (Highway 303) by the old Bremerton Junior High School between Sheridan Rd and Sylvan Way.",FALSE,
1005,540,,,,"No description",,,47.5815509,-122.6136449,"Mountain View Middle School","Located on the corner of Perry ave and Holman St.",FALSE,
1006,540,,,,"No description",,,48.111668,-123.443814,"Queen of Angeles - Parish Hall","From S Lincoln (Highway 101) turn onto 11th St.",FALSE,
1007,540,,,,"No description",,,48.093803,-123.103018,"Hardy's Market",,FALSE,
1008,540,,,,"No description",,,48.0106006,-122.7687353,"Joy Luck Restauraunt",,FALSE,
1009,540,,,,"No description",,,46.986437,-123.879278,"Immanuel Baptist Church",,FALSE,
1010,540,,,,"No description",,,46.9755515,-123.8426851,"Grays Harbor County Government - Pearsall Building",,FALSE,
1011,540,,,,"No description",welcome@pflc.org,,47.7335484,-122.6440872,"Poulsbo First Lutheran Church","Follow Highway 305 and turn toward the marina at Hostmark.  Turn right on 4th Ave.",FALSE,
1012,540,,,,"No description",,,47.5667764,-122.675112,"The Pearl on Oyster Bay","Located at the Pearl Senior Affordable Housing at Bay Vista.  From Highway 3 take the Kitsap Way exit east.  Turn right at Oyster Bay Ave, then right onto Russell Rd.",FALSE,
1013,540,,,,"No description",,,47.566195,-122.641021,"Kiwanis Park","Located in Kiwanis Park between 4th and 5th Streets off High Ave.",FALSE,
1014,540,,,,"No description",,,46.685411,-123.736067,"Raymond Senior Center",,FALSE,
1015,540,,,,"No description",,,48.0797144,-123.0860791,"Trinity United Methodist Church","Located near Carrie Blake Park in Sequim.",FALSE,
1016,540,,,,"No description",faith@silverlink.net,,47.635729,-122.7329999,"Faith Fellowship Church",,FALSE,
1017,540,,,,"No description",,,47.5680086,-122.6302166,"Opal Robertson Teen Center","Located on the corner of Park Ave and 7th Street.",FALSE,
1018,540,,,,"No description",peninsulas211@gmail.com,,,,"Peninsulas 2-1-1 Emergent Needs",,FALSE,
1019,540,,,,"No description",,,47.5395454,-122.6344671,"Spirit of Truth Fellowship","From Bay St go south on Sidney Ave 2 blocks and turn left onto Dekalb St.",FALSE,
1020,540,,,,"No description",toysfortotskitsap@yahoo.com,,47.6334123,-122.6640916,"Kitsap Presidents Hall","Located in the smaller blue roofed building on the hill behind the big blue building on Fairgrounds Rd.",FALSE,
1021,540,,,,"No description",director@bremertonfoodline.net,,47.5722114,-122.6402101,"Bremerton Foodline","One block south of the Bremerton High School on the corner of 12th and Sidney Ave.",FALSE,
1022,540,,,,"No description",,,47.7335484,-122.6440872,"First Lutheran Church","From Front St (the Marina) or NE Hostmark St turn north on 4th Ave.  Church is located on the right side of the street.",FALSE,
1023,540,,,,"No description",,,47.211836,-123.100779,"40 et 8","Located on W Cota St near S 1st St.",FALSE,
1024,540,,,,"No description",,,47.216766,-123.106424,"Lewis-Mason-Thurston Area Agency on Aging","Located across from the library.",FALSE,
1025,540,,,,"No description",,,47.567116,-122.624095,"Bremerton Eagles","Located on the corner of 6th and Washington.",FALSE,
1026,540,,,,"No description",,,48.1154349,-122.7722662,"Red Cross Emergency Shelter","Food Bank at entrance of Mountain View Commons (formerly Mountain View Elementary School) on Blaine St.",FALSE,
1027,540,,,,"No description",,,47.7356369,-122.645846,"Poulsbo City Hall","Located in the Poulsbo City Hall.  From Front St turn onto Jensen Way.  Turn right onto Moe St.",FALSE,
1028,540,,,,"No description",,,47.5183119,-122.6304134,"Kitsap Transfer Station - Safeway Port Orchard","Located in the transfer station near the intersection of Bethel and SE Lund Avenues.",FALSE,
1029,540,,,,"No description",,,47.6564168,-122.6908066,"Kitsap Mall","Located in Silverdale along Silverdale Way NW and Kitsap Mall Blvd.",FALSE,
1030,540,,,,"No description",,,48.0333914,-122.7641149,"Tri-Area Christmas for Children","No physical location.",FALSE,
1031,540,,,,"No description",,,47.438901,-122.831195,"Belfair Elementary Gym","Located on State Route 3 near the Mary E Theler Community Center.",FALSE,
1032,540,,,,"No description",,,47.5417483,-122.6372031,"Moon Dogs II",,FALSE,
1033,540,,,,"No description",,,48.13094,-123.11986,"Dungeness Community Church","Located approximately five miles north of downtown Sequim at the intersection of Sequim Dungeness Way and Eberle Lane. From Highway 101, take the Sequim Avenue exit North, and go directly through downtown, staying on Sequim Avenue, which turns into Sequim",FALSE,
1034,540,,,,"No description",info@serenityhouseclallam.org,,48.115465,-123.425713,"Serenity House Hygiene Center","Located on E 1st St.",FALSE,
1035,540,,,,"No description",,,47.5554271,-122.5450941,"Kiwanis Club - Manchester Family Inn","Located in the Manchester Family Inn on the corner of E Main St and Colchester Dr E.",FALSE,
1036,540,,,,"No description",,,47.0045196,-123.4013747,"Elma Food Bank","From Olympic Highway 12 take the Elma exit.  Turn right onto S 3rd St, then right on W Main St.  Located adjacent to the senior center, across from the Timberland Library.",FALSE,
1037,540,,,,"No description",,,46.963416,-123.800349,"South Aberdeen Baptist Church","From the South Shore Mall travel north on State Route 105.  Turn right on Fordney St.",FALSE,
1038,540,,,,"No description",,,46.9545314,-123.8111259,"Alder Grove Church of God","From South Boone St (Highway 105) turn onto Coolidge Rd.",FALSE,
1039,540,,,,"No description",,,46.98072,-123.888216,"Kaleo Iglesia de Hoquiam","From Lincoln St (Highway 101) turn onto Emerson Ave (State Route 109).  Turn onto 4th St.",FALSE,
1040,540,,,,"No description",,,46.9771703,-123.837017,"Harbor City Church","From Sumner Ave or Simpson Ave (Highway 101) turn north onto N Scammel St.",FALSE,
1041,540,,,,"No description",,,46.960824,-123.8066628,"South Shore Mall","Located in the South Shore Mall off Highway 105 in Aberdeen.  Enter the building through the east side middle doors and turn right.  Located opposite the food court.",FALSE,
1042,540,,,,"No description",,,46.982843,-123.597968,"Montesano Church of God","From Highway 12 take the Montesano exit.  Turn right onto Main St.  Turn right onto Spruce St E.  Located kitty-corner to the Montesano High School.",FALSE,
1043,540,,,,"No description",,,47.638634,-122.534544,"Bainbridge Island Sportsmans Club",,FALSE,
1044,541,,,,"No description",,,46.979304,-123.811821,"NeighborWorks of Grays Harbor County","Take Highway 12 (Wishkah St) and follow right from the Wishkah Bridge.  Next turn right at the light on Market Street.  Neighborworks sits between D and C Streets.",FALSE,
1045,542,,,,"No description",,,47.5674416,-122.6309592,"Kitsap Rescue Mission","Located on 6th Street between the Salvation Army and 7-Eleven.",FALSE,
1046,542,,,,"No description",,,47.5665071,-122.6331986,"Kitsap Rescue Mission - 5th St","Located on the corner of 5th and Warren Ave.",FALSE,
1047,542,,,,"No description",,,47.5722114,-122.6402101,"Kitsap Rescue Mission - Bremerton Foodline","One block south of the Bremerton High School on the corner of 12th and Sidney Ave.",FALSE,
1048,542,,,,"No description",,,47.5994383,-122.6281894,"Kitsap Rescue Mission - Wheaton Way Veterinary Hospital","From Wheaton Way turn onto Ivy at Husky Auto Repair.  Meal is served at the Wheaton Way Veterinary Hospital.",FALSE,
1049,542,,,,"No description",,,47.5228935,-122.6294953,"Kitsap Rescue Mission - Christian Life Center","From Highway 16 take the Tremont exit.  Follow Tremont then take a right onto SE Lund Ave.  Turn Left on Bethel Ave, then right on Mitchell Rd or SE Lincoln Ave.",FALSE,
1050,543,,,,"No description",,,47.4568123,-123.2155407,"Mason County Government - Hoodsport Drop Box Station",,FALSE,
1051,543,,,,"No description",,,47.341067,-123.093395,"Mason County Government - Union Drop Box Station",,FALSE,
