id,organization_id,accessibility,admin_emails,alternate_name,description,email,languages,latitude,longitude,name,transportation,virtual,website
519,253,,,,"No description",,,47.6048368,-122.6311413,"Goodwill - Bremerton","Located on Wheaton Way/Highway 303 across from K-Mart.",FALSE,
520,253,,,,"No description",,,47.656713,-122.6830242,"Goodwill - Silverdale","Take exit to Silverdale on WA-3 W.  Turn right at Kitsap Mall Blvd NW, continue up Ridgetop Blvd.  Turn left at Mickelberry Rd on left opposite Costco.",FALSE,
521,254,,,,"No description",bthane@oesd.wednet.edu,,47.5658184,-122.6691225,"Washington State Department of Early Learning - Bremerton","From Kitsap Way turn onto National Ave.  Located in the Olympic Educational Service DIstrict 114 near the top of the hill next to West Sound Tech.",FALSE,
522,254,,,,"No description",bthane@oesd.wednet.edu,,47.5658184,-122.6691225,"Olympic Educational Service District 114","From Kitsap Way turn onto National Ave.  Located near the top of the hill next to West Sound Tech.",FALSE,
523,255,,,,"No description",e.d@hohtribe-nsn.org,,47.7411351,-124.412689,"Hoh Indian Tribe","From Highway 101 turn west onto Lower Hoh Rd.",FALSE,
524,256,,,,"No description",hrc@hollyridge.org,,47.587716,-122.71844,"Holly Ridge Center","Take Chico Way to Northlake Way NW, then follow to the end of NW Taylor Rd.",FALSE,
525,257,,,,"No description",lgressley@cablespeed.com,,48.1033582,-122.8012775,"Jefferson County Council of the Blind","Meets at the Highway 20 Roadhouse between the roundabouts on Sims Way.",FALSE,
526,258,,,,"No description",altaleecrawford@gmail.com,,48.0325363,-122.7725515,"Jefferson County Literacy Council","Utilizes the Jefferson County Library at the intersection of Ness Corner Rd and Cedar Ave.",FALSE,
527,259,,,,"No description",kitsapride@kitsaptransit.org,,47.5637083,-122.6253429,"Kitsap Transit","Located inside the Bremerton Transportation Center.",FALSE,
528,260,,,,"No description",info@ivcbainbridge.org,,47.6273861,-122.5173134,"Island Volunteer Caregivers","Call for more information.",FALSE,
529,261,,,,"No description",sue.hay@wsu.edu,,48.1183967,-122.7515544,"Jefferson County 4-H","Downtown Port Townsend at the very end of town. In Port Hudson Marina look for the Cupola House, with the WSU Flag on top.",FALSE,
530,262,,,,"No description",gneal@co.kitsap.wa.us,,47.5403732,-122.6362492,"Kitsap County Commission on Children and Youth","No physical location.",FALSE,
531,263,,,,"No description",medelape@co.kitsap.wa.us,,47.5403732,-122.6362492,"Kitsap Youth Mentoring Consortium","No physical location.",FALSE,
532,263,,,,"No description",,,47.239554,-122.4642393,"Kitsap Youth Mentoring Consortium - Juvenile Rehabilitation Administration","From Highway 16 exit north onto Sprague Ave.  Turn left onto S 19th St.  Turn left onto S Trafton St.",FALSE,
533,263,,,,"No description",medelape@co.kitsap.wa.us,,47.521756,-122.6642601,"Kitsap Youth Mentoring Consortium - Kitsap County Juvenile Department","From Highway 16 take the Tremont/SW Clifton Exit.  Turn west onto SW Old CLifton Rd.  Take the next left onto the Juvenile Rehabilitation Center.",FALSE,
534,264,,,,"No description",,,48.1016379,-123.5204327,"Lower Elwha Klallam Tribe - Dental Clinic","Located along Olympic Highway 101.",FALSE,
535,264,,,,"No description",,,48.1169073,-123.4275632,"Lower Elwha Klallam Tribe - Heritage Center","Located on the corner of East 1st and North Peabody Streets.",FALSE,
536,264,,,,"No description",,,48.1377842,-123.5436346,"Lower Elwha Klallam Tribe - Housing Authority","From Lower Elwha Rd Turn south on Full Moon Trail, follow to Kwitsen Dr.",FALSE,
537,264,,,,"No description",,,48.1128969,-123.417718,"Lower Elwha Klallam Tribe - Klallam Counseling Services","Located on the corner of E 1st St and S Chambers St across from Taco Time and Angeles Furniture.",FALSE,
538,264,,,,"No description",,,48.139535,-123.547365,"Lower Elwha Klallam Tribe - Child Care","From Port Angeles follow Lower Elwha Rd west, turn south on Stratton Rd.",FALSE,
539,264,,,,"No description",,,48.1016379,-123.5204327,"Lower Elwha Klallam Tribe - Health Clinic","Located on Olympic Highway 101 near S Dry Creek Rd.",FALSE,
540,264,,,,"No description",,,48.1440352,-123.5486715,"Lower Elwha Klallam Tribe","From Port Angeles follow Lower Elwha Rd west.  Tribal center located just west of the intersection of Lower Elwha Rd and Stratton Rd.",FALSE,
541,264,,,,"No description",,,48.1379226,-123.5468294,"Lower Elwha Klallam Tribe - Head Start","From Port Angeles follow Lower Elwha Rd west, turn south on Stratton Rd.",FALSE,
542,265,,,,"No description",pfoa@olypen.com,,48.0839611,-123.200411,"Peninsula Friends of Animals","Located on Highway 101 between Sequim and Port Angeles.  Shelter is between Shore and Barr roads.",FALSE,
543,266,,,,"No description",,,,,"Olympic Mountain Pet Pals","Call for more information.",FALSE,
544,267,,,,"No description",,,47.5948921,-122.6132871,"Progressive Animal Welfare Society of Bremerton","Take NE Sylvan Way to Perry Ave, turn right and travel about 2.5 blocks.  On the right there will be a two story home surrounded by a green hedge and a white and blue sign that saws PAWS of Bremerton",FALSE,
545,268,,,,"No description",manager@vimoclinic.org,,48.1146984,-123.4171026,"Volunteers in Medicine of the Olympics","Located near the corner of East Georgiana and North Race Streets.",FALSE,
546,268,,,,"No description",,,48.1200563,-123.4367773,"Volunteers in Medicine of the Olympics - Armory Square Mall","Located in the Armory Square Mall on West 1st St between N Cherry and N Oak Streets.",FALSE,
547,269,,,,"No description",,,47.75118,-122.645773,"North Kitsap Urgent Care and Family Practice","On Highway 305  take a right on Bond Rd, located kitty-corner to Central Market.",FALSE,
548,270,,,,"No description",,,47.7088384,-122.7204502,"Kitsap Naval Shipyards - Bangor Chaplain's Office","Located on Bangor Base",FALSE,
549,270,,,,"No description",,,47.5633117,-122.6460622,"Kitsap Naval Shipyards - Bremerton Chaplain's Office","Located on Naval Base Bremerton",FALSE,
550,270,,,,"No description",,,47.5626056,-122.6496604,"Kitsap Naval Shipyards - PSNS Bremerton","Located along the waterfront in Bremerton with gate entrances on Charleston Blvd and Naval Ave.",FALSE,
551,270,,,,"No description",,,,,"Kitsap Naval Shipyards - Bangor","From Highway 3 north of Silverdale turn onto the Trigger Ave exit.  From south of Poulsbo take the Trident Blvd exit.",FALSE,
552,270,,,,"No description",,,,,"Kitsap Naval Shipyards - Keyport","From SIlverdale Way NW turn right onto Highway 308.  Follow to Keyport.",FALSE,
553,271,,,,"No description",karen@pdrc.org,,48.11422,-123.429872,"Peninsula Dispute Resolution Center","Located on S Peabody St, across the street from the Clallam County Courthouse parking lot.  Our parking lot is near the intersection of East 4th St.  The PDRC office is located in the Lindberg Architect Building.",FALSE,
554,272,,,,"No description",,,48.114116,-123.439821,"Ministry Assisting Neighbors Needs With Agape","Located at the First Presbyterian Church on the corner of W 8th and Oak Streets.",FALSE,
555,273,,,,"No description",,,48.1147774,-123.4347801,"Peninsula Behavioral Health - Horizon Center","From East Front Street or East 1st Street turn south onto South Lincoln Street.",FALSE,
556,273,,,,"No description",info@peninsulabehavioral.org,,48.112513,-123.438848,"Peninsula Behavioral Health - Crisis Respite Center","Located in the former St Vincent de Paul Thrift store on E 8th near S Laurel Street.",FALSE,
557,273,,,,"No description",,,48.0830641,-123.1128838,"Peninsula Behavioral Health - Sequim","Located at the corner of N 5th and W Fir Streets.",FALSE,
558,273,,,,"No description",,,48.118557,-123.4362885,"Peninsula Behavioral Health - Arlene Engle Home","Located near the corner of 2nd and Oak Streets.",FALSE,
559,273,,,,"No description",info@peninsulabehavioral.org,,48.1122743,-123.4381435,"Peninsula Behavioral Health","Located on the corner of E 8th and S Lincoln Streets.",FALSE,
560,274,,,,"No description",,,47.5387442,-122.6377725,"Peninsula Regional Support Network","From Bay St turn onto Dekalb St.  Turn right onto Cline Ave.  Turn left onto Division St.  Turn left onto Austin Ave.  Located on the first floor of the building on the right.",FALSE,
561,275,,,,"No description",info@pgst.nsn.us,,47.8521554,-122.5693153,"Port Gamble S'Klallam Tribe","Follow Highway 3 to Poulsbo.  Take the Highway 305 Exit toward downtown Poulsbo.  Turn left onto Bond Dr.  Bond Rd turns into Hwy 104. Drive straight through the first light then turn left at the second light by a large Albertsons store. You are then on ",FALSE,
562,275,,,,"No description",,,47.8727734,-122.5460987,"Port Gamble S'Klallam Tribe - Tribal Clinic","From Poulsbo take Bond Rd north.  Bond Rd turns into Highway 104.  Turn left onto Hansville Rd NE.  Turn left onto NE Little Boston Rd.",FALSE,
563,275,,,,"No description",,,47.8387922,-122.5459699,"Port Gamble S'Klallam Tribe - Recovery Center","From Poulsbo take Bond Rd north.  Bond Rd turns into Highway 104.  Turn left onto Hansville Rd NE.  Turn left onto NE Little Boston Rd.",FALSE,
564,275,,,,"No description",,,47.8727724,-122.5460976,"Port Gamble S'Klallam Tribe - Health and Human Services","From Poulsbo take Bond Rd north.  Bond Rd turns into Highway 104.  Turn left onto Hansville Rd NE.  Next turn left on NE Little Boston Rd, and follow to the Tribal center.",FALSE,
565,276,,,,"No description",qtc@quileutenation.org,,47.9081335,-124.6352255,"Quileute Nation","Located in La Push.",FALSE,
566,276,,,,"No description",,,47.9081335,-124.6352255,"Quileute Health Clinic","Located on the corner of La Push Rd and Quileute Heights.",FALSE,
567,276,,,,"No description",,,47.9087873,-124.6363782,"Quileute Tribe - Courthouse","Located at the intersection of Quileute and River Streets.",FALSE,
568,277,,,,"No description",,,48.090122,-123.102345,"Sequim Alzheimer's Support Group","Located in the Sequim Bible Church on N Sequim Ave.",FALSE,
569,278,,,,"No description",,,48.1411839,-123.4429864," U.S. Coast Guard Air Station - Sector Field Office Port Angeles","From W Front St (Highway 101) take Marine Dr west.  Continue following Marine Dr and it will become Ediz Hook Rd.",FALSE,
570,279,,,,"No description",securityfinancial@hotmail.com,,47.5425521,-122.6259715,"Security Financial","Located on Bay St at the Westbay Center.",FALSE,
571,280,,,,"No description",slc@silverdalelutheran.org,,47.6696137,-122.668135,"Silverdale Lutheran Church","From Ridgetop Blvd W and turn onto Ridgepoint Dr NW.",FALSE,
572,281,,,,"No description",,,48.1196153,-123.4350225,"Social Security Administration - Clallam and Jefferson","On the 1st floor of the brick Federal Building at the SE corner of 1st and Oak.  No parking except for handicapped.",FALSE,
573,282,,,,"No description",,,48.0217704,-123.1273844,"Sequim Community Aid","No physical location.",FALSE,
574,282,,,,"No description",,,48.109457,-123.173798,"Sequim Community Aid - Sequim Prairie Grange","From N Sequim Ave take the roundabout west onto Old Olympic Highway.  FOllow the Old Olympic Highway out past Carlsborg to the intersection with Cays Rd at the Sky Ridge Golf Course.  Continue straight through the intersection onto Mac Leay Rd.  Sequim Pr",FALSE,
575,283,,,,"No description",,,47.5255123,-122.6293477,"South Kitsap Family Kitchen","Located at the First Lutheran Community Church.  From the intersection of SE Lund and Bethel Rd turn north on Bethel.  Take a right on Mitchell Rd and follow to the First Lutheran Church.",FALSE,
576,284,,,,"No description",info@skookum.org,,48.1076031,-122.7744484,"Skookum - Jefferson",,FALSE,
577,284,,,,"No description",info@skookum.org,,47.5605256,-122.6758841,"Skookum - Bremerton","Located in the old Dodge dealership on Auto Center Way.",FALSE,
578,285,,,,"No description",wskitsap@esd.wa.gov,,47.595934,-122.624846,"WorkSource - Kitsap","Located on the corner of Almira Dr and Sylvan Way, in the white building across from the library and post office.",FALSE,
579,286,,,,"No description",,,48.1200563,-123.4367773,"WorkSource - Clallam","Located in the Armory Square Shopping Mall between N Cherry and S Oak Streets.",FALSE,
580,287,,,,"No description",,,48.0404164,-122.7850649,"WorkSource - Jefferson","From State Route 20 turn onto State Route 19 (Airport Cutoff Rd).  Turn left onto W Patison St.",FALSE,
581,288,,,,"No description",,,47.7285238,-122.5586924,"Suquamish Tribe","From Suquamish Clearwater Casino on Highway 305 turn north on Suquamish Way NE.  Located near intersection of Suquamish Way NE and Division Ave NE.",FALSE,
582,288,,,,"No description",,,47.7285238,-122.5586924,"Suquamish Tribe - Wellness Center","Located near the intersection of Suquamish Way NE and Division Ave NE.",FALSE,
583,288,,,,"No description",,,47.7056031,-122.5824666,"Suquamish Tribe - Tribal Education Department","From from Poulsbo follow Highway 305 toward Bainbridge Island. Turn right onto Sandy Hook Rd NE after the the gas station and mini-mart.",FALSE,
584,288,,,,"No description",,,47.721841,-122.577685,"Suquamish Tribe - Marion Forsman-Boushie Early Learning Center","From Suquamish Way NE turn west onto NE Totten Rd.  Located on the left-hand side of the road.",FALSE,
585,289,,,,"No description",vicmwebb@aol.com,,47.6355461,-122.6447815,"Twice the Spice","Call for location of next meeting.",FALSE,
586,290,,,,"No description",,,47.5650133,-122.6695887,"West Sound Technical Skills Center","Take Kitsap Way from Highway 18.  Turn right on National Ave, located at apex of hill.",FALSE,
587,291,,,,"No description",info@wstcs.org,,47.525033,-122.667918,"West Sound Treatment Center","Exit Highway 16 at Tremont/SW Old Clifton Rd. and turn west onto Tremont/SW Old Clifton Rd.  Turn right into the Port Orchard Industrial Park at Lloyd Parkway, and right onto Lumsden Rd. West Sound Treatment Center is 1 block on the right in the Fuller-Wi",FALSE,
588,292,,,,"No description",admin@westsoundyfc.org,,47.6549427,-122.7034804,"West Puget Sound Youth for Christ","Located near Central Kitsap Junior High in Silverdale.",FALSE,
589,293,,,,"No description",,,47.946783,-124.392944,"West End Outreach Service","Located across the street from Forks Community Hospital.",FALSE,
590,294,,,,"No description",info@nkfishline.org,,47.7419618,-122.6600972,"North Kitsap Fishline","Located from NE Hostmark St turn onto 3rd Ave NE.  In Poulsbo down by the marina.",FALSE,
591,294,,,,"No description",info@nkfishline.org,,47.7345669,-122.6473219,"North Kitsap Fishline - Second Season Thrift Store","Located near corner of NE Hostmark St and 3rd Ave NE.  Down by the marina.",FALSE,
592,295,,,,"No description",,,47.9502674,-124.384316,"Clallam County Fire District #1","On the corner of Spartan Avenue and Division.",FALSE,
593,296,,,,"No description",pafire@cityofpa.us,,48.1150236,-123.436199,"Port Angeles Fire Department","Located on E 5th Street between S Lincoln and S Laurel Streets.",FALSE,
594,297,,,,"No description",info@clallamfire3.org,,48.0825955,-123.1132251,"Clallam County Fire District #3","From W Washington St turn North on N 5th Ave .  Located across from W Alder St.",FALSE,
595,298,,,,"No description",,,47.68128,-122.540019,"Bainbridge Island Fire Department - Phelps Road","From Highway 305 turn east on NE Day Rd and take the immediate left onto NE Phelps Rd.",FALSE,
596,298,,,,"No description",,,47.621434,-122.5434619,"Bainbridge Island Fire Department - Bucklin Hill Rd","Located across from Hila Middle School near the intersection of NE Bucklin Hill Dr and Blakey Ave NE.",FALSE,
597,298,,,,"No description",,,47.6439447,-122.5207779,"Bainbridge Island Fire Department","Located at the corner of Highway 305 and Madison Ave N.",FALSE,
598,299,,,,"No description",,,47.740482,-122.637962,"Poulsbo Fire Department","Located on Highway 305 near the intersection with NE Liberty Rd.",FALSE,
599,300,,,,"No description",info@skfr.org,,47.5312225,-122.5993143,"South Kitsap Fire and Rescue","Stations located throughout South Kitsap.",FALSE,
600,301,,,,"No description",police@cityofportorchard.us,,47.5414554,-122.6391883,"Port Orchard Police Department","Located at the city hall near the corner of Bay St and Kitsap St.",FALSE,
601,302,,,,"No description",mikec@ccsww.org,,46.979076,-123.819303,"Catholic Community Services - Grays Harbor Family Center","Located at St Mary's Catholic Church on the corner of North H and East 3rd St.",FALSE,
602,302,,,,"No description",erinp@ccsww.org,,46.9784749,-123.8214339,"Catholic Community Services - Grays Harbor - Amazing Grace Lutheran Church","Located in the Amazing Grace Lutheran Church on the corner of North I and East 4th streets.",FALSE,
603,303,,,,"No description",,,47.446554,-122.828671,"Harrison Medical Center - Belfair","Located on Highway 3 in Belfair.",FALSE,
604,303,,,,"No description",,,47.7397248,-122.636322,"Harrison HealthPartners - Hematology & Oncology - Poulsbo","From Highway 305 turn east onto NE Liberty Rd.  Turn right onto 10th Ave NE.  Located on the left after passing the Fire Department.",FALSE,
605,303,,,,"No description",,,47.6429391,-122.5209887,"Harrison Medical Center - Bainbridge Island","From Highway 305 turn west onto Madison Ave N by the Fire Station and Bainbridge First Baptist Church.",FALSE,
606,303,,,,"No description",,,47.585464,-122.6289211,"Harrison Medical Center - St Paul's Episcopal Church","From Warren Ave turn right onto Callahan Dr.  Located in the large brown church around the corner.",FALSE,
607,303,,,,"No description",,,47.5223182,-122.6565252,"Harrison Medical Center - Port Orchard","From Highway 16 turn east on the Tremont St Exit.  FOllow Tremont and turn right onto S Kitsap Blvd.",FALSE,
608,303,,,,"No description",,,47.655322,-122.6752865,"Harrison Medical Center - Silverdale","From Highway 303 take the Ridgetop Blvd exit.  Turn west down toward Silverdale.  Turn right into the medical center.",FALSE,
609,303,,,,"No description",,,47.5829852,-122.6251384,"Harrison Medical Center - East Bremerton","North of the Warren Ave Bridge, take Callahan Dr to Cherry Ave.",FALSE,
610,303,,,,"No description",,,47.651507,-122.6848178,"Harrison HealthPartners - Center for Behavioral Health","From NW Bucklin Hill Rd or Ridgetop Blvd turn onto Levin Rd.",FALSE,
611,303,,,,"No description",,,47.655322,-122.6752865,"Harrison Medical Center - The Orthopaedic Center at Harrison","Located next to Harrison Silverdale.  From Highway 303 Waaga Way take the Ridgetop Blvd exit.  Turn left at the stoplight onto Ridgetop Blvd NW.  Turn right onto NW Myhre Rd.",FALSE,
612,304,,,,"No description",director@bremertonfoodline.net,,47.5722114,-122.6402101,"Bremerton Foodline","One block south of the Bremerton High School on the corner of 12th and Sidney Ave.",FALSE,
613,305,,,,"No description",georganns@indepthcounseling.net,,47.7466739,-122.652619,"In Depth Counseling","From the intersection of Viking Way and Finn Hill etc.  Take the 2nd driveway to the right.",FALSE,
614,306,,,,"No description",,,,,"Abraxas Counseling Services","Call for more information.",FALSE,
615,307,,,,"No description",,,47.6300151,-122.5181131,"Agate Passage Psychological Services","From Winslow Way E take Ericksen Ave NE north.  Turn left on Knechtel Way NE.",FALSE,
616,307,,,,"No description",marymixon@agatepassage.com,,47.7332977,-122.6382189,"Agate Passage Psychological Services - Poulsbo Office","From Highway 305 turn west on NE Hostmark St.  Office is located to the left.",FALSE,
617,308,,,,"No description",,,47.75118,-122.645773,"Alpha Counseling","Located at the corner of Highway 305 and Bond Rd NE in the North Kitsap Medical Center Building A Suite 108.",FALSE,
618,309,,,,"No description",,,47.5639113,-122.6535739,"Julie Elkinton, MA","Located on the corner of Callow and 1st St.",FALSE,
619,310,,,,"No description",,,47.6703624,-122.6675262,"Peninsula Psychological Center","Located off Ridgetop Blvd next to Ridgetop Animal Hospital.",FALSE,
620,310,,,,"No description",,,47.5415382,-122.6381826,"Peninsula Psychological Center - Port Orchard","FromBay St turn onto Kitsap St or Sidney Ave, the onto Prospect.",FALSE,
621,310,,,,"No description",,,47.75118,-122.645773,"Peninsula Psychological Center - Poulsbo","From Highway 305 turn south onto Bond Rd NE.  Located in the big brown building.",FALSE,
622,311,,,,"No description",roger@hypnosishealthinfo.com,,47.6300151,-122.5181131,"Roger Moore's Counseling and Hypnotherapy","From Highway 305 turn right onto Winslow Way W, then right on Ericksen Ave NE.  Turn left onto Knechtel Way NE.",FALSE,
623,312,,,,"No description",susananderson@gmail.com,,47.6272671,-122.5170503,"Susan Anderson, MA, LMHC, RN","From Highway 305 turn right onto Winslow Way E.  Turn right onto Eriksen Ave NE.",FALSE,
624,313,,,,"No description",,,47.644976,-122.6980893,"Kathy G Warcup, MA, MHC","Located in old town Silverdale.  From SIlverdale Way turn onto NW Byron Rd, then left onto Pacific Ave.",FALSE,
625,314,,,,"No description",,,47.6544009,-122.6934998,"Pacific Counseling Clinic","On Kitsap Way turn into the driveway next to Toys 'R Us.  Located in the building next to the AMC Theater.",FALSE,
626,315,,,,"No description",celebratelifeinc@hotmail.com,,47.5395835,-122.6405605,"Celebrate Life Pregnancy Support - Kitsap","Off Bay St in the Bayside Plaza.",FALSE,
627,316,,,,"No description",billb@billboyettlmft.com,,47.52282,-122.652983,"Bill Boyett, MA, LMFT","From Tremont St W take Pottery Ave south.",FALSE,
628,317,,,,"No description",ccft@silverlink.net,,47.6319803,-122.6367767,"Center for Child and Family Therapy","From Wheaton Way take Fairgrounds Rd west, turn left on Old Military Rd, then the next left.",FALSE,
629,317,,,,"No description",ccft@silverlink.net,,47.524895,-122.646634,"Center for Child and Family Therapy - Port Orchard","Located on off Tremont Ave near Farmers Insurance.",FALSE,
630,318,,,,"No description",sheila@deandoering.com,,47.6292899,-122.5161405,"Child & Family Psychiatric Associates","From Highway 305 turn right onto Winslow Way E.  Turn right onto Ericksen Ave NE.",FALSE,
631,319,,,,"No description",,,48.108308,-123.428544,"Mark Gray, MA, LMHC","Located at the cross street of Eunice and 8th Streets.",FALSE,
632,320,,,,"No description",dckellynwhz@hotmail.com,,47.7466739,-122.652619,"New Horizons Counseling","From Viking Way turn est onto Lindvig Way (opposite NW Finn Hill Rd).",FALSE,
633,320,,,,"No description",dckellynwhz@hotmail.com,,48.040134,-122.7849727,"New Horizons Counseling","Located south of the Rhody Dr and Irondale Rd intersection.",FALSE,
634,321,,,,"No description",counselingoffices@wavecable.com,,47.52282,-122.652983,"Sarah Boss, MS, LMHC, EMDR","From Highway 16 take the Tremont exit east.  Turn right on Pottery Ave, located after Clay Ln.",FALSE,
635,322,,,,"No description",drdianejohnson@gmail.com,,48.040134,-122.7849727,"Discovery Center for Behavioral Health","From Rhody Dr (Highway 19) turn east on W Patison St at the Shold Business Park sign--Discovery Center is in middle section of the building behind the big fish in the parking lot.",FALSE,
636,323,,,,"No description",,,,,"Kay Drescher, LMFT, MA, EMDR","Call for directions.",FALSE,
637,324,,,,"No description",shaktidst@gmail.com,,48.117689,-122.797779,"Higher Power Healing","Located near the corner of 25th and Wilson St, just north of the Laurel Grove Cemetery off Discovery Rd.",FALSE,
638,325,,,,"No description",,,47.645049,-122.697586,"Karen Gorman, MA Psychology, LMHC","Located in downtown Silverdale.  From Silverdale Way turn onto NE Byron St.  Next turn left onto Pacific NW Ave and then right onto NE Lowell St.",FALSE,
639,326,,,,"No description",,,46.976183,-123.883411,"Social Security Administration - Grays Harbor","Located in Hoquiam next to Venture Bank and across from Edward Jones Investments. From the east take HWY 101 (which is Wishkah St, then Alder St, then Sumner St, then Riverside) and follow the signs for Hoquiam city center, then take a left on Simpson. Fr",FALSE,
640,327,,,,"No description",,,47.693383,-122.666223,"Brittney Morgensen, MA, LMFT","From Silverdale Way NW turn onto NW Mountain View Rd.",FALSE,
641,328,,,,"No description",,,47.609328,-122.510998,"Ellen M. Johnson, MS, LMHC","Call for more information.",FALSE,
642,329,,,,"No description",ksac@wavecable.com,,,,"Kitsap Sexual Assault Center","Call for more information.",FALSE,
643,330,,,,"No description",,,47.1278271,-123.0948547,"Squaxin Island Tribe - Northwest Indian Treatment Center - Shelton/Kamilche","From Highway 101 take the Highway 108/SE Old Olympic Highway exit east at the Little Creek Casino Resort.",FALSE,
644,330,,,,"No description",nwitc_intake@yahoo.com,,47.0056836,-123.397807,"Squaxin Island Tribe - Northwest Indian Treatment Center - Elma","From Highway 8 take the 12S exit north.  Turn left onto E Main St.  Turn right onto Young St.  Turn right on F St.",FALSE,
645,330,,,,"No description",,,47.1216071,-123.0796574,"Squaxin Island Tribal Center","Take SE Old Olympic Highway to SE Klah Che Min Dr, take the first right.",FALSE,
646,331,,,,"No description",msstowell@aol.com,,47.6300151,-122.5181131,"Mary Stowell, PhD, LMHC","From Highway 305 turn west on Winslow Way East, then right on Ericksen Ave NE.  Next turn left on Knechtel Way NE.",FALSE,
647,332,,,,"No description",sallymcintoshstoehr@gmail.com,,47.631793,-122.517278,"Sally McIntosh Stoehr, LMFT","From Highway 305 turn onto Highschool road. Proceed through the circle and exit onto Madison Avenue on the right. Turn LEFT onto Wallace Avenue. Turn RIGHT onto Ericksen avenue. Building on your immediate right.",FALSE,
648,333,,,,"No description",,,47.6491668,-122.6932062,"Hoffman and Hoffman","From the Kitsap Mall take SIlverdale Way south.  Turn left onto Bucklin Hill Rd and take the next right onto Bayshore Dr NW.",FALSE,
