id,organization_id,accessibility,admin_emails,alternate_name,description,email,languages,latitude,longitude,name,transportation,virtual,website
259,136,,,,"No description",CityAdmin@ci.bainbridge-isl.wa.us,,47.6263099,-122.520497,"City of Bainbridge Island","Take Olympic Way to Winslow Way E, then turn onto Madison Ave.  Two blocks north of Eagle Harbor Waterfront Park.",FALSE,
260,137,,,,"No description",info@forkswashington.org,,47.9503801,-124.3784498,"City of Forks","Take Forks Ave to Division St, one block east of N Spartan Ave.",FALSE,
261,138,,,,"No description",cityhall@cityofportorchard.us,,47.5411792,-122.6387446,"City of Port Orchard","Located just off Bay St, take Robert Geiger Rd or Frederick St to Prospect.",FALSE,
262,139,,,,"No description",,,48.1162874,-122.7534821,"City of Port Townsend","Off Washington St, between Memorial Field Ball Park and the waterfront.",FALSE,
263,139,,,,"No description",ptlibrary@cityofpt.us,,48.1164711,-122.7629577,"City of Port Townsend - Port Townsend Public Library","Located near the intersection of Lawrence St and Filmore St.",FALSE,
264,140,,,,"No description",,,47.7356369,-122.645846,"City of Poulsbo","From Highway 3 exit at the Finn Hill Exit. From Finn Hill Rd NW follow throught the traffic light onto Lindvig Way NW. Go straight through the traffic light onto Front Street NE. At the 4-way stop sign turn left onto Jensen Way NE. The first street on the",FALSE,
265,140,,,,"No description",parksrec@cityofpoulsbo.com,,47.7403817,-122.6494502,"City of Poulsbo - Parks and Recreation","On Front St between NE Peterson and NE Sunset streets.",FALSE,
266,140,,,,"No description",,,47.7356369,-122.645846,"City of Poulsbo - Public Works","From Highway 3 exit at the Finn Hill Exit. From Finn Hill Rd NW follow throught the traffic light onto Lindvig Way NW. Go straight through the traffic light onto Front Street NE. At the 4-way stop sign turn left onto Jensen Way NE. The first street on the",FALSE,
267,141,,,,"No description",,,48.085361,-123.113511,"City of Sequim - Public Works","Located on N 5th Ave between Olympic Discovery Trail and W Fir St.",FALSE,
268,141,,,,"No description",,,48.0807912,-123.1037854,"City of Sequim","On W Cedar off N Sequim Rd.",FALSE,
269,142,,,,"No description",,,48.084018,-123.114555,"Compassionate Friends - North Olympic Peninsula Chapter","Located in St Lukes Episcopal Church on N 5th Ave in Sequim.",FALSE,
270,143,,,,"No description",theupside@comcast.net,,47.647028,-122.659666,"Down Syndrome Support Group of Kitsap and Surrounding Areas","Meets in the Central Kitsap Presbyterian Church on the Corner of Nels Nelson and NW Silver St.",FALSE,
271,144,,,,"No description",,,48.1118734,-122.7671483,"Jefferson County District Courthouse","From E Sims Way take Washington St to Jefferson St.",FALSE,
272,144,,,,"No description",,,48.1047974,-122.7903239,"Jefferson County Government - Public Works","Located near Jefferson Healthcare.",FALSE,
273,144,,,,"No description",,,48.111021,-122.8271402,"Jefferson County Government - Transfer Station","Located on Jacob Miller Rd, 3/4 mile off Highway 20 just outside Port Townsend.",FALSE,
274,144,,,,"No description",,,47.8212652,-122.8861927,"Jefferson County Government - Quilcene Solid Waste Dropbox","Located south of Quilcene.",FALSE,
275,145,,,,"No description",,,48.0325363,-122.7725515,"Jefferson County Library","Located by Ness Corner Rd (SR 116).",FALSE,
276,146,,,,"No description",info@dovehousejc.org,,48.1071095,-122.7925957,"Dove House Advocacy Services","From W Sims Way turn north onto Sheridan St.  Turn right onto 10th St.  Corner of 10th and Cleveland",FALSE,
277,147,,,,"No description",info@operationuplift.org,,48.1102689,-123.4114523,"Operation Uplift","Located near the intersection of E 1st and N Liberty Streets.",FALSE,
278,148,,,,"No description",,,47.575258,-122.6352127,"Olympic College","Located just south of the Warren Ave bridge.",FALSE,
279,148,,,,"No description",poulsbocampus@olympic.edu,,47.7516392,-122.6602632,"Olympic College - Poulsbo","North on Highway 305, up the hill from Wal-Mart and Home Depot.",FALSE,
280,149,,,,"No description",,,47.6131822,-122.6239979,"Kitsap Recovery Center","From Wheaton Way (Highway 303) turn north onto NE Fuson Rd next to Lowes Home Improvement Center.  Kitsap Recovery Center is location at the top of the hill before the road corners onto Almira Dr NE.",FALSE,
281,150,,,,"No description",,,48.1358369,-123.746064,"Crescent School District","Located at the intersection of Piedmont Rd (Highway 112), Joyce-Piedmont Rd, and Crescent Beach Rd.",FALSE,
282,151,,,,"No description",drc@kitsapdrc.org,,47.645057,-122.694898,"Dispute Resolution Center","In Old Town Silverdale on Washington between NW Lowell and NW Byron Streets.",FALSE,
283,152,,,,"No description",,,47.7989034,-122.4979752,"Kitsap Regional Library - Kingston","Located near the Kingston-Edmonds Ferry, and is surrounded by Highway 104, Iowa Ave NE, and NE 1st St.",FALSE,
284,152,,,,"No description",,,47.6463441,-122.6962878,"Kitsap Regional Library - Silverdale","From Silverdale Way NW, turn onto NW Carlton St by the Central Kitsap School District Building.",FALSE,
285,152,,,,"No description",,,47.7358163,-122.6397001,"Kitsap Regional Library - Poulsbo","From Highway 305 turn west onto NE Lincoln Rd.",FALSE,
286,152,,,,"No description",,,47.542443,-122.63576,"Kitsap Regional Library - Port Orchard","From Bay St turn north toward the waterfront on Sidney Ave.",FALSE,
287,152,,,,"No description",,,47.8727792,-122.5461055,"Kitsap Regional Library - Little Boston","From Hansville Rd NE turn west onto Little Boston Rd NE.",FALSE,
288,152,,,,"No description",dblibrary@krl.org,,47.5667587,-122.6284617,"Kitsap Regional Library - Downtown Bremerton","From 6th St in Bremerton turn south onto Pacific Ave.  Take the next right onto 5th Ave.  Located opposite the Kitsap Sun.",FALSE,
289,152,,,,"No description",bilibrary@krl.org,,47.6352645,-122.5205154,"Kitsap Regional Library - Bainbridge Island","From Highway 305 turn west onto High School Rd NE.  Take the roundabout south to the library.",FALSE,
290,152,,,,"No description",swlibrary@krl.org,,47.5951125,-122.624949,"Kitsap Regional Library - Sylvan Way","From Wheaton Way turn east onto Sylvan Way.  Library located on the right next to the Post Office, and across from WorkSource.",FALSE,
291,152,,,,"No description",,,47.5558919,-122.5446565,"Kitsap Regional Library - Manchester","From SE Mile Hill Rd turn onto Colchester Dr SE.  Located at the intersection of Colchester and Main St.",FALSE,
292,153,,,,"No description",,,47.8223137,-122.8757199,"Quilcene Lions Club","No physical location",FALSE,
293,154,,,,"No description",wlis@qlsd.wednet.edu,,47.823099,-122.8732819,"Quilcene School District","Located on US Highway 101 in Quilcene.",FALSE,
294,155,,,,"No description",,,47.948215,-124.381387,"Quillayute Valley School District #402 - Forks Elementary School","From S Forks Ave (Highway 101) turn east A St SE, then right onto S Elderberry.",FALSE,
295,155,,,,"No description",,,47.9458733,-124.383823,"Quillayute Valley School District #402 - Forks Alternative School","From S Forks Ave (Highway 101) turn east onto East E St.",FALSE,
296,155,,,,"No description",,,47.9477759,-124.3825504,"Quillayute Valley School District #402 - Forks Junior/Senior High School","From S Forks Ave (Highway 101) turn east onto East E St, then left onto Spartan Ave.",FALSE,
297,155,,,,"No description",,,47.9465766,-124.3839542,"Quillayute Valley School District 402","From S Forks Ave (Highway 101) turn east onto East E St, then left onto Spartan Ave.  Located near Forks Jr High.",FALSE,
298,155,,,,"No description",,,47.9511524,-124.3843047,"Quillayute Valley School District #402 - Forks Intermediate School","From S Forks Ave (Highway 101) turn east onto East E St, the left onto Spartan Ave.",FALSE,
299,156,,,,"No description",rperegrin@co.clallam.wa.us,,48.1155739,-123.4337165,"Clallam County Sheriff's Office - Emergency Management Division","Located in the basement of Clallam County Courthouse between S Lincoln and S Peabody St.",FALSE,
300,157,,,,"No description",,,48.0240674,-122.7650732,"Jefferson County Department of Emergency Management","From Chimacum Rd or Old Hadlock Rd, turn onto Elkins Rd at the Bates Jefferson Ball Fields.",FALSE,
301,158,,,,"No description",,,,,"St Vincent de Paul - Kitsap - Women's Shelter","Location is confidential.  Address will be given during Housing Solutions Center intake.",FALSE,
302,158,,,,"No description",,,47.5713595,-122.6533017,"St Vincent de Paul - Bremerton","From 11th St turn north onto Callow Ave.  St Vincent de Paul is located on the left side of the street.",FALSE,
303,158,,,,"No description",,,47.5434829,-122.6294331,"St Vincent de Paul - Port Orchard","Located on Bay St between the Comfort Inn and Bay Ford.",FALSE,
304,158,,,,"No description",,,47.7357493,-122.6277753,"St Vincent de Paul - Poulsbo","Located in St Olaf's Church on Caldart Ave near North Kitsap High School.",FALSE,
305,158,,,,"No description",,,47.5711819,-122.6532988,"St Vincent de Paul Thrift Store - Bremerton","From 11th St turn north onto Callow Ave.  St Vincent de Paul is located on the left side of the street.",FALSE,
306,159,,,,"No description",,,47.9506586,-123.3456072,"St Vincent de Paul - Port Angeles","No physical location.",FALSE,
307,159,,,,"No description",,,48.0217704,-123.1273844,"St Vincent de Paul - Sequim","No physical address.",FALSE,
308,160,,,,"No description",,,48.11497,-123.443186,"Olympic Medical Physicians - Primary Care Clinic - 8th & Cherry","Located at the corner of 8th and Cherry Streets.",FALSE,
309,160,,,,"No description",,,48.0883648,-123.1156208,"Olympic Medical Sleep Center","Located at the Squeim Medical Plaza off North 5th Avenue and West Hendrickson Road.  The Sleep Center is in Suite 106.",FALSE,
310,160,,,,"No description",,,48.089429,-123.1119067,"Olympic Medical Physicians - Specialty Clinic - Sequim","Located in the Olympic Medical Park on N 5th Ave, south of Old Olympic Highway in Suite 1500.",FALSE,
311,160,,,,"No description",,,48.114809,-123.415326,"Olympic Medical Physicians - Women's Clinic","Located on Caroline St across from Olympic Medical Center.",FALSE,
312,160,,,,"No description",,,48.089429,-123.1119067,"Olympic Medical Physicians - Walk-in Clinic - Sequim","Located in the Olympic Medical Park on N 5th Ave, south of Old Olympic Highway in Suite 1400.",FALSE,
313,160,,,,"No description",,,48.114735,-123.413496,"Olympic Medical Physicians - Surgery Clinic","Located on Caroline St across from Olympic Medical Center.",FALSE,
314,160,,,,"No description",,,48.1142725,-123.4160547,"Olympic Medical Physicians - Specialty Clinic - Port Angeles","Located on Georgiana St between Olympic Medical Center and E Front St (Highway 101).",FALSE,
315,160,,,,"No description",,,48.1124203,-123.4144574,"Olympic Medical Physical Therapy and Rehabilitation - Port Angeles","Located near the corner of East Front Street (Highway 101) and North Chambers Street.",FALSE,
316,160,,,,"No description",,,48.0897886,-123.1130828,"Olympic Medical Physicians - Primary Care Clinic - Sequim","Located in Suite 101 of the N 5th St at the Olympic Medical Center Sequim Campus.",FALSE,
317,160,,,,"No description",,,48.0883648,-123.1156208,"Olympic Medical Physicians - Orthopaedic Clinic - Sequim","Located off N 5th Ave next to Sherwood Assisted Living.",FALSE,
318,160,,,,"No description",,,48.0897886,-123.1130828,"Olympic Medical Physical Therapy and Rehabilitation - Sequim","Located in Suite 102 of Olympic Medical Center Sequim Campus off the N 5th St.",FALSE,
319,160,,,,"No description",,,48.1145841,-123.4145927,"Olympic Medical Physicians - Orthopaedic Clinic - Port Angeles","Located on Caroline St across from Olympic Medical Center.",FALSE,
320,160,,,,"No description",,,48.089429,-123.1119067,"Olympic Medical Services Building","Located in the Olympic Medical Park on N 5th Ave, south of Old Olympic Highway.",FALSE,
321,160,,,,"No description",,,48.0899562,-123.113084,"Olympic Medical Center - Cancer Center","Located in the Olympic Medical Park on N 5th Ave south of the Old Olympic Highway.",FALSE,
322,160,,,,"No description",,,48.114237,-123.4159673,"Olympic Medical Center - Home Health","Located near the corner of Georgiana St and N Washington St.",FALSE,
323,160,,,,"No description",webmaster@olympicmedical.org,,48.1152561,-123.4150459,"Olympic Medical Center","From East Front Street or East 1st Street turn north onto North Race Street or North Washington Streets.  FLoow to Caroline Street and Olympic Medical Center.",FALSE,
324,160,,,,"No description",,,48.110375,-123.431939,"Olympic Medical Physicians - Primary Care Clinic - 8th & Vine","Located at the corner of 8th and Vine Streets.",FALSE,
325,161,,,,"No description",,,47.5335162,-122.6371904,"Kitsap County Division of Aging and Long-Term Care","From Highway 16 take the Tremont Ave exit east.  Follow Tremont and turn left on Sidney Ave.  Located in the Givens Community Center on the left.",FALSE,
326,161,,,,"No description",,,47.6529349,-122.6924217,"Kitsap County Division of Aging and Long-Term Care - Caregiver Support Center","From Kitsap Mall Blvd turn right onto Silverdale Way NW.  Turn right into the old Poplars Hotel (behind Bank of America).",FALSE,
327,162,,,,"No description",acarver@pencol.edu,,47.950358,-124.3854369,"Peninsula College - Forks Extension",,FALSE,
328,162,,,,"No description",admissions@pencol.edu,,48.1003007,-123.4107632,"Peninsula College","From E Front St or Highway 101 turn south onto N Race St.  Turn left onto E Laurdisen Blvd and follow to the college campus.",FALSE,
329,163,,,,"No description",parks@co.kitsap.wa.us,,47.6320501,-122.663112,"Kitsap County Parks and Recreation","Located at the Kitsap County Fairgrounds.",FALSE,
330,163,,,,"No description",,,47.6517961,-122.6941955,"Kitsap County Parks and Recreation - Silverdale Community Center","From the Kitsap Mall travel south on Silverdale Way NW.  Turn right at the Community Center before the intersection with NW Bucklin Hill Rd.",FALSE,
331,163,,,,"No description",,,47.7984994,-122.4980321,"Kitsap County Parks and Recreation - Kingston Community Center","Located near the Kingston-Edmonds Ferry at the intersection of NE West Kingston Rd and Highway 104.",FALSE,
332,163,,,,"No description",,,47.6826734,-122.6632694,"Kitsap County Parks and Recreation - Island Lake Community Room","From Silverdale travel north on Silverdale Way NW.  Travel past Ridgetop Blvd NW and take the next right onto Bennington Dr NW.  Follow to NW Island Lake Rd.",FALSE,
333,163,,,,"No description",,,47.6334123,-122.6640916,"Kitsap County Parks and Recreation - Kitsap Fairgrounds & Events Center","Located at the Kitsap County Fairgrounds.  In Bremerton take Wheaton Way (Highway 303) to NW Fairground Rd.  Follow to the Fairgrounds.",FALSE,
334,163,,,,"No description",,,47.5014394,-122.5819941,"Kitsap County Parks and Recreation - Long Lake County Park","From SE Sedgwick Rd turn south onto Bodie Rd SE.  Park at intersection with Long Lake Rd SE.",FALSE,
335,164,,,,"No description",info@jeffersonmhs.org,,48.105899,-122.803778,"Jefferson Mental Health Services","884 West Park is in the Port Townsend Business Park, off Simms Way not far from Port Townsend city limits.",FALSE,
336,165,,,,"No description",maureen.woods@makah.com,,48.3679635,-124.6235483,"Neah Bay Tribal Senior Center","Located on 341 Bayview Ave on the beach side at driving towards the Tribal Center.",FALSE,
337,166,,,,"No description",info@kitsapchildrenstherapy.com,,47.7380977,-122.6426385,"Kitsap Children's Therapy","From Highway 305 turn west onto NE Lincoln Rd.  Go straight through the intersection onto NE Iverson St.  Turn right onto 7th Ave NE.",FALSE,
338,167,,,,"No description",,,46.9812451,-123.8205866,"Harborcrest Behavioral Health","Traveling west, Highway 12 into Aberdeen, turn right on Broadway, then right on 6th St. for 2.5 blocks. 
Traveling east, Wishkah Blvd take left on Broadway, right on 6th for 2.5 blocks.",FALSE,
339,168,,,,"No description",admin@hagh.com,,46.9792554,-123.8139192,"Housing Authority of Grays Harbor County","Located on the corner of E 1st St and N E St.",FALSE,
340,169,,,,"No description",qyouthresources@gmail.com,,47.632771,-122.651159,"Q Youth Resources","Located under the same roof as the Family of God Lutheran church on the corner of Central Valley Rd and Fairgrounds Rd. Not affiliated with the church.",FALSE,
341,170,,,,"No description",dem@co.kitsap.wa.us,,47.5547031,-122.6811369,"Kitsap County Department of Emergency Management","From the South: Take Hwy. 16 to Hwy. 3 North. Exit Hwy. 3 North at Loxie Eagans exit. Turn left. Go to Union Ave, turn left. Go up the hill and turn right on Linden, then turn right on Carver. Our building will be on the left. From the North: Take Hwy. 3 ",FALSE,
342,171,,,,"No description",information@cityofpa.us,,48.1143639,-123.4320721,"City of Port Angeles","Located in the City Hall between S Lincoln and S Peabody St.",FALSE,
343,171,,,,"No description",,,48.0803194,-123.2754019,"City of Port Angeles - Blue Mountain Transfer Station","From Port Angeles - Head east on Highway 101 for approximately 5.5 miles. Turn right onto Blue Mountain Road. Proceed about 1 mile to the station. Gate is on the right.
From Sequim - Head west on Highway 101 for approximately 6.5 miles. Turn left onto blu",FALSE,
344,172,,,,"No description",,,47.6977649,-122.89733,"Brinnon Community Center","Located on Highway 101 north of the Brinnon General Store.",FALSE,
345,173,,,,"No description",poulsbo@kacewa.org,,,,"Kitsap Adult Center for Education - Poulsbo","Located at Poulsbo First Lutheran Church at the intersection of NE Hostmark and 4th Ave NE.",FALSE,
346,173,,,,"No description",info@kacewa.org,,47.5667463,-122.628631,"Kitsap Adult Center for Education","Located downstairs in the Downtown Library on 5th St, between Pacific and Park Ave.  It is just across the street from the Kitsap Sun and behind the Admiral Theater.",FALSE,
347,173,,,,"No description",johnr@kacewa.org,,47.540804,-122.636762,"Kitsap Adult Center for Education - South Kitsap Family Service Center","Meets at the United Methodist Church in Port Orchard.",FALSE,
348,174,,,,"No description",,,48.084018,-123.114555,"St Luke's Episcopal Church","From W Fir St turn north onto 5th Ave.",FALSE,
349,175,,,,"No description",,,47.7341243,-122.6459295,"North Kitsap Senior Center","From Highway 305 turn west on NE Hostmark St and continue onto Front St.",FALSE,
350,176,,,,"No description",,,46.9757434,-123.8174897,"Aberdeen Police Department","Located on the corner of E Market and S I St.",FALSE,
351,177,,,,"No description",,,46.9535206,-123.7683046,"Cosmopolis Police Department","Located near the corner of 1st St (Highway 101) and D St.",FALSE,
352,178,,,,"No description",police@cityofelma.com,,47.0050292,-123.4038045,"Elma Police Department","Located on the corner of N 3rd and W Young streets.",FALSE,
353,179,,,,"No description",,,46.981869,-123.6021151,"Grays Harbor Sheriff's Department","Located at the courthouse on the corner of Broadway and N Main St.",FALSE,
354,180,,,,"No description",jmyers@cityofhoquiam.com,,46.976512,-123.880285,"Hoquiam Police Department","Located near the corner of 10th and Levee St, just off Simpson Ave.",FALSE,
355,181,,,,"No description",george.c@cityofmccleary.com,,47.055385,-123.26394,"McCleary Police Department","Located on the corner of S 3rd St and W Simpson Ave at the city hall.",FALSE,
356,182,,,,"No description",,,46.9817738,-123.600456,"Montesano Police Department","Located on the corner of N Main St and Broadway Ave.",FALSE,
357,183,,,,"No description",,,47.346921,-124.2927746,"Taholah Police Department","From State Route 109 turn west onto Cuitan St.  Located at the intersection with 3rd Ave.",FALSE,
358,184,,,,"No description",records@ci.westport.wa.us,,46.8931933,-124.1040188,"Westport Police Department","Located on the corner of E Washington and N Montesano St.",FALSE,
359,185,,,,"No description",info@habitatclallam.org,,48.114633,-123.420703,"Habitat for Humanity of Clallam County","Located on East Front Street between Eunice and Francis Streets.",FALSE,
360,185,,,,"No description",,,48.0798598,-123.1092842,"Habitat for Humanity of Clallam County - Sequim","Located on W Washington St between 3rd and 4th Ave.",FALSE,
361,186,,,,"No description",director@habitatejc.org,,48.1029712,-122.7992916,"Habitat for Humanity of East Jefferson County","Located on W Sims Way at the intersection with Thomas St.",FALSE,
362,187,,,,"No description",familyservices@kitsaphabitat.org,,47.5973488,-122.629412,"Habitat for Humanity of Kitsap County","On the corner of Wheaton and Sylvan Ways.",FALSE,
363,187,,,,"No description",storemanager@kitsaphabitat.org,,47.5962308,-122.6294422,"Habitat for Humanity of Kitsap County - The Habitat Store","Located near the corner of Wheaton and Sylvan Ways.",FALSE,
364,188,,,,"No description",,,48.1072037,-122.7903246,"Jefferson Healthcare - Surgery and Endoscopy Center","Located at the intersection of 10th and Sheridan St near Jefferson Healthcare.",FALSE,
365,188,,,,"No description",,,47.8218763,-122.8758901,"Jefferson Healthcare - South County Clinic","Located on Highway 101 in Quilcene.",FALSE,
366,188,,,,"No description",,,48.106975,-122.789823,"Jefferson Healthcare - Internal Medicine Clinic","Located 1 block north of Jefferson Healthcare off 10th Street.",FALSE,
367,188,,,,"No description",,,48.1049559,-122.7881307,"Jefferson Healthcare - 7th Street Clinic","Located on the corner of Sheridan Avenue and 7th Street.",FALSE,
368,188,,,,"No description",,,47.920713,-122.699304,"Jefferson Healthcare - Port Ludlow Clinic","Located on Oak Bay Rd across from the Port Ludlow ViIlage.",FALSE,
369,188,,,,"No description",,,48.1028348,-122.8055055,"Jefferson Healthcare - Home Health and Hospice","Located next to the roundabout on W Sims way off Howard St.",FALSE,
370,188,,,,"No description",,,48.1072037,-122.7903246,"Jefferson Healthcare - Madrona Family Medicine Clinic","Located at the intersection of 10th and Sheridan St near Jefferson Healthcare.",FALSE,
371,188,,,,"No description",,,48.1072037,-122.7903246,"Jefferson Healthcare - Family Medicine","Located at the intersection of 10th and Sheridan St near Jefferson Healthcare.",FALSE,
372,188,,,,"No description",,,48.106975,-122.789823,"Jefferson Healthcare - Walk-in Clinic","Located near Jefferson Healthcare on the corner of 10th and Sheridan Streets.",FALSE,
373,188,,,,"No description",,,48.1053429,-122.7902936,"Jefferson Healthcare","Take W Sims way and turn north onto Sheridan St.",FALSE,
374,188,,,,"No description",,,48.1067813,-122.7906383,"Jefferson Healthcare - Medical and Pediatric Group","Located on Sheridan a block north of Jefferson Healthcare Hospital.",FALSE,
375,189,,,,"No description",proa@qwestoffice.net,,47.5655971,-122.6294023,"Puget Rental Owners Association","Located on the corner of 4th and Park Ave.",FALSE,
376,190,,,,"No description",shelter@hsjcwa.org,,48.1028017,-122.8279172,"Humane Society of Jefferson County","Located by the county landfill.  From Highway 20 turn west onto S. Jacob Miller Rd. past fire station turn left to transfer station and left onto Critter Lane.",FALSE,
377,191,,,,"No description",,,48.1007391,-123.4328414,"Olympic National Park","Park can be reached from one of many exits of Highway 101.",FALSE,
378,192,,,,"No description",,,47.5671523,-122.6299712,"City of Bremerton - Municipal Court","Located on the corner of 6th St and Park Ave.",FALSE,
379,192,,,,"No description",,,47.5640818,-122.6722842,"City of Bremerton - Utility Billing","Call for more information.",FALSE,
380,192,,,,"No description",parks@ci.bremerton.us,,47.5822754,-122.6296377,"City of Bremerton - Sheridan Park Community Center","On Lebo just west of the Warren Ave bridge, near Lions Field.",FALSE,
381,192,,,,"No description",,,47.5669819,-122.6257395,"City of Bremerton","Located in the Norm Dicks Building on the corner of 6th St and Pacific Ave.",FALSE,
382,193,,,,"No description",,,47.95038,-124.3784406,"Clallam County Government - District II Court",,FALSE,
383,193,,,,"No description",parks@co.clallam.wa.us,,48.1155739,-123.4337165,"Clallam County Government - Parks Department","Parks are located throughout county.  Call for more information.",FALSE,
384,193,,,,"No description",,,48.1155739,-123.4337165,"Clallam County Courthouse","Located in the City Hall between S Lincoln and S Peabody.",FALSE,
385,194,,,,"No description",kyle@ccfymca.org,,48.1120516,-123.4232724,"Olympic Peninsula YMCA","Located between Jesse Webster Park (the tree park) and Erickson Field west of the Dream Playground.",FALSE,
386,194,,,,"No description",,,48.1154349,-122.7722662,"Olympic Peninsula YMCA - Port Townsend","Located at the Mountain View Commons on the corner of Blaine and Walker Streets.",FALSE,
387,195,,,,"No description",office@foglc.org,,47.632771,-122.651159,"Family of God Lutheran Church","Located at the intersection of Central Valley and Fairgrounds roads.",FALSE,
388,196,,,,"No description",info@forkswashington.org,,47.9503801,-124.3784498,"Forks Police Department","Located at the corner of E Division St and Maple Ave.",FALSE,
389,197,,,,"No description",sheriff@co.kitsap.wa.us,,47.5403732,-122.6362492,"Kitsap County Sheriff's Office","From Bay St turn onto Kitsap St by the Port Orchard City Hall.  Turn right onto Cline Ave.  Parking for the courthouse will be on the left after Division St.",FALSE,
390,197,,,,"No description",sheriff@co.kitsap.wa.us,,47.6510395,-122.6954875,"Kitsap County Sheriff's Office - Silverdale",,FALSE,
391,198,,,,"No description",police@cityofpa.us,,48.1143639,-123.4320721,"Port Angeles Police Department","Located at the corner of S Peabody and East 4th and 5th Streets.",FALSE,
